<?xml version="1.0" encoding="utf-8"?>
<Booklet xmlns:xsi="http://www.w3.org/2001/XMLSchema-instance"
               xsi:noNamespaceSchemaLocation="https://raw.githubusercontent.com/iqb-berlin/testcenter/18.0.0-beta/definitions/vo_Booklet.xsd">
	<Metadata>
		<Id>Cy-Bklt_TC-2</Id>
		<Label>Test-Controller-2</Label>
		<Description>Testheft Test-Controller 2</Description>
	</Metadata>

	<BookletConfig>
		<Config key="force_presentation_complete">OFF</Config>
		<Config key="force_response_complete">OFF</Config>
		<Config key="unit_show_time_left">OFF</Config>
		<Config key="unit_menu">OFF</Config>
	</BookletConfig>

	<Units>
		<Unit id="CY-Unit.Sample-100" label="Startseite" labelshort="1" />

		<Testlet id="Tslt1" label="Aufgabenblock">
			<Restrictions>
				<CodeToEnter code="Hase">Bitte gib das Freigabewort ein.</CodeToEnter>
				<TimeMax minutes="1"/>
			</Restrictions>
			<Unit id="CY-Unit.Sample-101" label="Aufgabe1" labelshort="2"/>
			<Unit id="CY-Unit.Sample-102" label="Aufgabe2" labelshort="3"/>
			<Unit id="CY-Unit.Sample-103" label="Aufgabe3" labelshort="4"/>
		</Testlet>

		<Unit id="CY-Unit.Sample-104" label="Endseite" labelshort="5"/>
	</Units>
</Booklet>