<?xml version="1.0" encoding="utf-8"?>
<Booklet xmlns:xsi="http://www.w3.org/2001/XMLSchema-instance" xsi:noNamespaceSchemaLocation="https://raw.githubusercontent.com/iqb-berlin/testcenter/17.0.0/definitions/vo_Booklet.xsd">
	<Metadata>
		<Id>CY-BkltConfigDefaults</Id>
		<Label>Test Bklt Configs default</Label>
		<Description>Testen der Defaultwerte</Description>
	</Metadata>

	<BookletConfig>

		<!--its only important to navigated to the next page if page navibuttons are disabled -->
		<Config key="pagingMode">buttons</Config>

		<Config key="page_navibuttons">SEPARATE_BOTTOM</Config>
		<Config key="unit_menu">OFF</Config>
		<Config key="unit_navibuttons">FULL</Config>
		<Config key="force_presentation_complete">OFF</Config>
		<Config key="force_response_complete">OFF</Config>
		<Config key="unit_show_time_left">OFF</Config>
		<Config key="unit_time_left_warnings">1</Config>
		<Config key="restore_current_page_on_return">OFF</Config>
		<Config key="allow_player_to_terminate_test">ON</Config>
		<Config key="lock_test_on_termination">OFF</Config>
		<Config key="ask_for_fullscreen">OFF</Config>
		<Config key="show_fullscreen_button">OFF</Config>
		<Config key="unit_screenheader">EMPTY</Config>
		<Config key="unit_title">ON</Config>
		

	</BookletConfig>

	<Units>

		<Testlet id="Tslt1" label="Aufgabenblock">
			<Restrictions>
        <TimeMax minutes="2" leave = "confirm"/>
			</Restrictions>
			<Unit id="CY-Unit.Sample-101" label="Aufgabe1" labelshort="1"/>
      <Unit id="CY-Unit.Sample-102" label="Aufgabe2" labelshort="2"/>
		</Testlet>

		<Unit id="CY-Unit.Sample-104" label="Endseite" labelshort="3"/>
	</Units>
</Booklet>