<?xml version="1.0" encoding="utf-8"?>
<Booklet xmlns:xsi="http://www.w3.org/2001/XMLSchema-instance" xsi:noNamespaceSchemaLocation="https://raw.githubusercontent.com/iqb-berlin/testcenter/17.0.0/definitions/vo_Booklet.xsd">
	<Metadata>
		<Id>CY-Bklt_runhotres</Id>
		<Label>Controller Mode: run-hot-restart</Label>
		<Description>Test f√ºr den Modus run-hot-restart</Description>
	</Metadata>

	<BookletConfig>
		<Config key="force_presentation_complete">OFF</Config>
		<Config key="force_response_complete">OFF</Config>
		<Config key="unit_show_time_left">ON</Config>
		<Config key="unit_menu">ON</Config>
		<Config key="lock_test_on_termination">ON</Config>
	</BookletConfig>

	<Units>
		<Unit id="CY-Unit.Sample-100" label="Startseite" labelshort="1" />

		<Testlet id="Tslt1" label="Aufgabenblock">
			<Restrictions>
				<CodeToEnter code="Hase">Bitte gib das Freigabewort ein.</CodeToEnter>
				<TimeMax minutes="1"/>
				<DenyNavigationOnIncomplete presentation="ALWAYS" response="ALWAYS" />		
			</Restrictions>
			<Unit id="CY-Unit.Sample-101" label="Aufgabe1" labelshort="2"/>
			<Unit id="CY-Unit.Sample-102" label="Aufgabe2" labelshort="3"/>
			<Unit id="CY-Unit.Sample-103" label="Aufgabe3" labelshort="4"/>
		</Testlet>
		
		<Unit id="CY-Unit.Sample-104" label="Endseite" labelshort="5"/>
	</Units>
</Booklet>