<?xml version="1.0" encoding="utf-8"?>
<Booklet xmlns:xsi="http://www.w3.org/2001/XMLSchema-instance" xsi:noNamespaceSchemaLocation="https://raw.githubusercontent.com/iqb-berlin/testcenter/17.4.0/definitions/vo_Booklet.xsd">
  <Metadata>
    <Id>CY-Bklt_NavRestrBklt-0</Id>
    <Label>check response-/presentation-complete from booklet-config OFF</Label>
  </Metadata>

  <BookletConfig>
    <!--its only important to navigated to the next page if page navibuttons are disabled -->
    <Config key="pagingMode">buttons</Config>
    <Config key="force_presentation_complete">OFF</Config>
    <Config key="force_response_complete">OFF</Config>
  </BookletConfig>

  <Units>
    <Unit id="CY-Unit.Sample-101" label="Start" labelshort="1" alias="start"/>

    <Testlet id="Tslt1" label="Aufgabenblock">
      <Restrictions>
        <DenyNavigationOnIncomplete presentation="ALWAYS" response="ALWAYS" />
      </Restrictions>
      <Unit id="CY-Unit.Sample-101" label="Aufgabe1" labelshort="2"/>
      <Unit id="CY-Unit.Sample-102" label="Aufgabe2" labelshort="3"/>
    </Testlet>

    <Unit id="CY-Unit.Sample-104" label="Endseite" labelshort="4"/>
  </Units>
</Booklet>
