<?xml version="1.0" encoding="utf-8"?>
<Booklet xmlns:xsi="http://www.w3.org/2001/XMLSchema-instance" xsi:noNamespaceSchemaLocation="https://raw.githubusercontent.com/iqb-berlin/testcenter/17.3.0/definitions/vo_Booklet.xsd">
  <Metadata>
    <Id>CY-Bklt_NavRestrVal3</Id>
    <Label>test restriction parameter DenyNavigationOnIncomplete value-3</Label>
  </Metadata>

  <BookletConfig>

    <!--its only important to navigated to the next page if page navibuttons are disabled -->
    <Config key="pagingMode">buttons</Config>
    <Config key="force_presentation_complete">ON</Config>
    <Config key="force_response_complete">ON</Config>
  </BookletConfig>

  <Units>

    <Testlet id="Tslt1" label="Aufgabenblock">
      <Restrictions>
        <TimeMax minutes="2" leave = "confirm"/>
        <DenyNavigationOnIncomplete presentation="ALWAYS" response="ALWAYS" />
      </Restrictions>
      <Unit id="CY-Unit.Sample-101" label="Aufgabe1" labelshort="1"/>
      <Unit id="CY-Unit.Sample-101" label="Aufgabe2" labelshort="2" alias="unit-2"/>
    </Testlet>

    <Unit id="CY-Unit.Sample-104" label="Endseite" labelshort="3"/>
  </Units>
</Booklet>